[
  {
    "complaint_id": "acd6c4af-108e-444d-a90f-e90b67786c74",
    "complaint_number": "CMP-000001",
    "created_at": "2017-10-16T10:12:02.872Z",
    "policy_id": "8349345c-a6c5-4bf9-8ebb-6bbfc1628715",
    "policyholder_id": "3c74e595-48bc-4dd6-8ac7-2dee1c1f397b",
    "member_id": "673b8081-9668-4136-97cc-6ae0debda083",
    "complaint_status": "open",
    "app_data": {
      "key1": "value 1",
      "key2": "value 2"
    },
    "created_by": {
      "id": "00000000-0000-0000-0000-000000000001",
      "type": "user"
    }
  },
  {
    "complaint_id": "da20903b-7f0d-4318-96bd-6df78514e2fd",
    "complaint_number": "CMP-000002",
    "created_at": "2017-10-14T11:09:55.332Z",
    "policy_id": "76096ff5-f4ed-47e2-8ac0-de16ba095508",
    "policyholder_id": "aed6eedd-25d7-4a42-a2cf-8a8368dffc6e",
    "complaint_status": "closed",
    "app_data": {
      "key1": "value 1",
      "key2": "value 2"
    },
    "created_by": {
      "id": "00000000-0000-0000-0000-000000000001",
      "type": "user"
    }
  }
]